document name,begin offset,end offset,context left,text,context right
skylax_syntaxtrees_ud.conllu,20351,20354,Κηναίου Διὸς ἱεροῦ ,ἐπὶ," Γεραιστόν, Ποσειδῶνος ἱερόν,"
skylax_syntaxtrees_ud.conllu,20438,20440,ἐστιν ἡ Εὔβοια. ,ἐν, δὲ τῷ Αἰγαίῳ
skylax_syntaxtrees_ud.conllu,20479,20483,εἰσὶ νῆσοι αἵδε· ,κατ’, Ἐρέτριαν Σκῦρος καὶ
skylax_syntaxtrees_ud.conllu,20602,20606,"δίπολις, καὶ λιμήν. ",μετὰ, ταῦτα ἐπάνειμι πάλιν
skylax_syntaxtrees_ud.conllu,20628,20631,ταῦτα ἐπάνειμι πάλιν ,ἐπὶ," τὴν ἤπειρον, ὅθεν"
skylax_syntaxtrees_ud.conllu,20731,20734,γὰρ οὗτοι καὶ ,ἐπὶ, ταύτην τὴν θάλασσαν.
skylax_syntaxtrees_ud.conllu,20766,20768,θάλασσαν. καὶ ἔστιν ,ἐν, αὐτῇ πρῶτον ἱερὸν
skylax_syntaxtrees_ud.conllu,20867,20869,"Θῆβαι, Θεσπιαί, Ὀρχομενὸς ",ἐν, μεσογείᾳ. εἰσὶ δὲ
skylax_syntaxtrees_ud.conllu,20938,20941,τῆς Βοιωτίας χώρας ,ἀπὸ, Δηλίου μέχρι τῶν
skylax_syntaxtrees_ud.conllu,20949,20954,χώρας ἀπὸ Δηλίου ,μέχρι, τῶν Λοκρῶν ὁρίων
skylax_syntaxtrees_ud.conllu,21037,21041,ἔθνος. καί εἰσι ,κατ’, Εὔβοιαν αὐτοῖς πόλεις
skylax_syntaxtrees_ud.conllu,21234,21237,γὰρ καὶ οὗτοι ,εἰς, τὴν θάλασσαν ταύτην.
skylax_syntaxtrees_ud.conllu,21357,21359,ἄλλαι πόλεις αὐτοῖς ,ἐν, μεσογείᾳ. παράπλους δ’
skylax_syntaxtrees_ud.conllu,21477,21479,κόλπος ὁ Μηλιεύς. ,ἐν, τούτῳ τῷ κόλπῳ
skylax_syntaxtrees_ud.conllu,21819,21822,χώρᾳ ἐποικοῦσιν ἄνωθεν ,ἀπὸ," μεσογείας Αἰνιᾶνες, καὶ"
skylax_syntaxtrees_ud.conllu,21847,21850,"μεσογείας Αἰνιᾶνες, καὶ ",δι’, αὐτῶν ῥεῖ ὁ
skylax_syntaxtrees_ud.conllu,21959,21961,εἰσὶ δὲ καὶ ,ἐν, τῷ Παγασητικῷ κόλπῳ
skylax_syntaxtrees_ud.conllu,21982,21985,τῷ Παγασητικῷ κόλπῳ ,ἐπ’," ἀριστερᾷ εἰσπλέοντι, ὡς"
skylax_syntaxtrees_ud.conllu,22010,22013,"ἀριστερᾷ εἰσπλέοντι, ὡς ",ἐπὶ, τὸ ἥμισυ τοῦ
skylax_syntaxtrees_ud.conllu,22135,22137,ἄλλαι πόλεις Ἀχαιοῖς ,ἐν, μεσογείᾳ. Θετταλία. μετὰ
skylax_syntaxtrees_ud.conllu,22191,22194,Ἀχαιοὺς Θετταλία καθήκει ,ἐπὶ, θάλατταν ἐκ μεσογείας
skylax_syntaxtrees_ud.conllu,22204,22206,καθήκει ἐπὶ θάλατταν ,ἐκ, μεσογείας κατὰ στενὸν
skylax_syntaxtrees_ud.conllu,22217,22221,θάλατταν ἐκ μεσογείας ,κατὰ, στενὸν εἰς τὸν
skylax_syntaxtrees_ud.conllu,22229,22232,μεσογείας κατὰ στενὸν ,εἰς, τὸν Παγασητικὸν κόλπον
skylax_syntaxtrees_ud.conllu,22299,22302,Θετταλίας πόλεις αἵδε ,ἐπὶ," θαλάττῃ· Ἀμφῆναι, Παγασαί·"
skylax_syntaxtrees_ud.conllu,22330,22332,"θαλάττῃ· Ἀμφῆναι, Παγασαί· ",ἐν," δὲ μεσογείᾳ Φεραί,"
skylax_syntaxtrees_ud.conllu,22445,22447,ἄλλαι πόλεις Θετταλῶν ,ἐν, μεσογείᾳ. ἡ δὲ
skylax_syntaxtrees_ud.conllu,22480,22482,δὲ Θετταλία παρήκει ,ἐν, μεσογείᾳ ὑπὲρ Αἰνιάνων
skylax_syntaxtrees_ud.conllu,22492,22496,παρήκει ἐν μεσογείᾳ ,ὑπὲρ, Αἰνιάνων καὶ Δολόπων
skylax_syntaxtrees_ud.conllu,22554,22559,Ἀχαιῶν καὶ Μαγνήτων ,μέχρι, Τεμπῶν. τοῦ δὲ
skylax_syntaxtrees_ud.conllu,22606,22609,κόλπου μῆκός ἐστιν ,ἀπὸ, στόματος εἰς τὸν
skylax_syntaxtrees_ud.conllu,22619,22622,ἐστιν ἀπὸ στόματος ,εἰς, τὸν μυχὸν Παγασῶν
skylax_syntaxtrees_ud.conllu,22696,22698,ἐστι στάδια εʹ. ,ἐν, δὲ τῷ Παγασητικῷ
skylax_syntaxtrees_ud.conllu,22764,22768,καὶ πόλις. Μάγνητες. ,μετὰ, δὲ Θετταλίαν ἔθνος
skylax_syntaxtrees_ud.conllu,22802,22806,ἔθνος ἐστὶ Μάγνητες ,παρὰ," θάλατταν, καὶ πόλεις"
skylax_syntaxtrees_ud.conllu,22891,22894,"Ὀλιζών, Τίσαι λιμήν. ",ἔξω, δὲ τοῦ κόλπου
skylax_syntaxtrees_ud.conllu,22958,22960,"Ῥιζοῦς, Εὐρυμεναί, Ἄμυρος. ",ἐν, μεσογείᾳ δὲ ἐποικοῦσιν
skylax_syntaxtrees_ud.conllu,23010,23015,"ἔθνος Περραιβοί, Ἕλληνες. ",μέχρι, ἐνταῦθά ἐστιν ἀπὸ
skylax_syntaxtrees_ud.conllu,23030,23033,μέχρι ἐνταῦθά ἐστιν ,ἀπὸ, Ἀμβρακίας συνεχὴς ἡ
skylax_syntaxtrees_ud.conllu,23092,23094,καὶ τὰ ἐπιθαλάσσια ,ἐν, Ἑλλάδι ὁμοίως ἐστίν.
skylax_syntaxtrees_ud.conllu,23127,23130,ὁμοίως ἐστίν. Μακεδονία. ,ἀπὸ, δὲ Πηνειοῦ ποταμοῦ
skylax_syntaxtrees_ud.conllu,23358,23360,πόλις καὶ βασίλειον ,ἐν, αὐτῇ καὶ ἀνάπλους
skylax_syntaxtrees_ud.conllu,23379,23382,αὐτῇ καὶ ἀνάπλους ,εἰς, αὐτὴν ἀνὰ τὸν
skylax_syntaxtrees_ud.conllu,23389,23392,ἀνάπλους εἰς αὐτὴν ,ἀνὰ, τὸν Λουδίαν· Ἀξιὸς
skylax_syntaxtrees_ud.conllu,23487,23490,Παλλήνη ἄκρα μακρὰ ,εἰς," τὸ πέλαγος ἀνατείνουσα,"
skylax_syntaxtrees_ud.conllu,23531,23533,καὶ πόλεις αἵδε ,ἐν, τῇ Παλλήνῃ Ἑλληνίδες·
skylax_syntaxtrees_ud.conllu,23565,23567,Παλλήνῃ Ἑλληνίδες· Ποτίδαια ,ἐν, τῷ μέσῳ τὸν
skylax_syntaxtrees_ud.conllu,23676,23679,Παλλήνης ἱερὸν ἀκρωτήριον. ,ἔξω, δὲ τοῦ ἰσθμοῦ
skylax_syntaxtrees_ud.conllu,24040,24042,καὶ ἄλλαι Μακεδονίας ,ἐν, μεσογείᾳ πολλαί. ἔστι
skylax_syntaxtrees_ud.conllu,24091,24095,κολπώδης. παράπλους δὲ ,περὶ, τοὺς κόλπους δύο
skylax_syntaxtrees_ud.conllu,24121,24125,κόλπους δύο ἡμερῶν. ,μετὰ, δὲ Μακεδονίαν Στρυμὼν
skylax_syntaxtrees_ud.conllu,24218,24221,δὲ ἡ Θρᾴκη ,ἀπὸ, Στρυμόνος ποταμοῦ μέχρι
skylax_syntaxtrees_ud.conllu,24240,24245,ἀπὸ Στρυμόνος ποταμοῦ ,μέχρι, Ἴστρου ποταμοῦ τοῦ
skylax_syntaxtrees_ud.conllu,24265,24267,Ἴστρου ποταμοῦ τοῦ ,ἐν, τῷ Εὐξείνῳ Πόντῳ.
skylax_syntaxtrees_ud.conllu,24294,24296,Πόντῳ. εἰσὶ δὲ ,ἐν, Θρᾴκῃ πόλεις Ἑλληνίδες
skylax_syntaxtrees_ud.conllu,24386,24390,ἄλλα ἐμπόρια Θασίων. ,κατὰ, ταῦτά ἐστι Θάσος
skylax_syntaxtrees_ud.conllu,24509,24513,ὅθεν ἐξετραπόμην. Νεάπολις ,κατὰ, ταύτην. Δάτον πόλις
skylax_syntaxtrees_ud.conllu,24658,24662,Δίκαια καὶ Μαρώνεια. ,κατὰ, ταῦτα Σαμοθρᾴκη νῆσος
skylax_syntaxtrees_ud.conllu,24696,24700,νῆσος καὶ λιμήν. ,κατὰ, ταύτην ἐν τῇ
skylax_syntaxtrees_ud.conllu,24708,24710,λιμήν. κατὰ ταύτην ,ἐν, τῇ ἠπείρῳ ἐμπόρια
skylax_syntaxtrees_ud.conllu,24770,24773,ποταμὸς Ἕβρος καὶ ,ἐπ’," αὐτῷ τεῖχος Αἶνος,"
skylax_syntaxtrees_ud.conllu,24823,24825,λιμήν. τείχη Αἰνίων ,ἐν," τῇ Θρᾴκῃ, Μέλας"
skylax_syntaxtrees_ud.conllu,24944,24948,Ἴμβρος καὶ Λῆμνος. ,κατὰ, τὸν Μέλανα κόλπον
skylax_syntaxtrees_ud.conllu,25039,25042,λιμήν. ἐπάνειμι πάλιν ,ἐπὶ," τὴν ἤπειρον, ὅθεν"
skylax_syntaxtrees_ud.conllu,25086,25090,ὅθεν ἐξετραπόμην. Χερρόνησος. ,μετὰ, δὲ τὸν Μέλανα
skylax_syntaxtrees_ud.conllu,25150,25152,Χερρόνησος. καὶ πόλεις ,ἐν," αὐτῇ αἵδε· Καρδία,"
skylax_syntaxtrees_ud.conllu,25233,25236,"Ἐλαιοῦς, Μάδυτος, Σηστὸς ",ἐπὶ, τοῦ στόματος τῆς
skylax_syntaxtrees_ud.conllu,25333,25339,"Κρῆσσα, Κριθώτη, Πακτύη. ",μέχρις, ἐνταῦθα ἡ Θρᾳκία
skylax_syntaxtrees_ud.conllu,25369,25371,ἡ Θρᾳκία Χερρόνησος. ,ἐκ, Πακτύης δὲ εἰς
skylax_syntaxtrees_ud.conllu,25383,25386,ἐκ Πακτύης δὲ ,εἰς, Καρδίαν διὰ τοῦ
skylax_syntaxtrees_ud.conllu,25395,25398,δὲ εἰς Καρδίαν ,διὰ, τοῦ αὐχένος πεζῇ
skylax_syntaxtrees_ud.conllu,25427,25429,"πεζῇ στάδια μʹ, ",ἐκ, θαλάττης εἰς θάλατταν·
skylax_syntaxtrees_ud.conllu,25439,25442,"μʹ, ἐκ θαλάττης ",εἰς, θάλατταν· καὶ πόλις
skylax_syntaxtrees_ud.conllu,25463,25465,θάλατταν· καὶ πόλις ,ἐν, τῷ μέσῳ ᾗ
skylax_syntaxtrees_ud.conllu,25506,25508,Ἀγορά. Χερρονήσου μῆκος ,ἐκ," Καρδίας εἰς Ἐλαιοῦντα,"
skylax_syntaxtrees_ud.conllu,25517,25520,μῆκος ἐκ Καρδίας ,εἰς," Ἐλαιοῦντα, ταύτῃ γάρ"
skylax_syntaxtrees_ud.conllu,25569,25573,"μακροτάτη, στάδια υʹ. ",μετὰ, δὲ τὴν Χερρόνησόν
skylax_syntaxtrees_ud.conllu,25755,25758,πόλις καὶ λιμήν. ,ἀπὸ, τούτου ἐπὶ τοῦ
skylax_syntaxtrees_ud.conllu,25766,25769,λιμήν. ἀπὸ τούτου ,ἐπὶ, τοῦ στόματος τοῦ
skylax_syntaxtrees_ud.conllu,25850,25853,Ἀνάπλους ὁ τόπος ,ἀνὰ, Βόσπορον μέχρι ἂν
skylax_syntaxtrees_ud.conllu,25878,25881,μέχρι ἂν ἔλθῃς ,ἐφ’, Ἱερόν. ἀφ’ Ἱεροῦ
skylax_syntaxtrees_ud.conllu,25889,25892,ἔλθῃς ἐφ’ Ἱερόν. ,ἀφ’, Ἱεροῦ δὲ τὸ
skylax_syntaxtrees_ud.conllu,25953,25955,ζʹ. εἰσὶ δὲ ,ἐν, τῷ Πόντῳ πόλεις
skylax_syntaxtrees_ud.conllu,25987,25989,πόλεις Ἑλληνίδες αἵδε ,ἐν," Θρᾴκῃ· Ἀπολλωνία, Μεσημβρία,"
skylax_syntaxtrees_ud.conllu,26094,26097,δὲ τῆς Θρᾴκης ,ἀπὸ, Στρυμόνος ποταμοῦ μέχρι
skylax_syntaxtrees_ud.conllu,26116,26121,ἀπὸ Στρυμόνος ποταμοῦ ,μέχρι, Σηστοῦ δύο ἡμερῶν
skylax_syntaxtrees_ud.conllu,26156,26159,καὶ νυκτῶν δύο· ,ἀπὸ, δὲ Σηστοῦ μέχρι
skylax_syntaxtrees_ud.conllu,26170,26175,ἀπὸ δὲ Σηστοῦ ,μέχρι, στόματος τοῦ Πόντου
skylax_syntaxtrees_ud.conllu,26223,26226,καὶ νυκτῶν δύο· ,ἀπὸ, δὲ τοῦ στόματος
skylax_syntaxtrees_ud.conllu,26243,26248,δὲ τοῦ στόματος ,μέχρι, τοῦ Ἴστρου ποταμοῦ
skylax_syntaxtrees_ud.conllu,26318,26321,ὁ σύμπας περίπλους ,ἀπὸ, Θρᾴκης καὶ ποταμοῦ
skylax_syntaxtrees_ud.conllu,26351,26356,καὶ ποταμοῦ Στρυμόνος ,μέχρι, Ἴστρου ποταμοῦ ὀκτὼ
skylax_syntaxtrees_ud.conllu,26417,26421,"νυκτῶν. Σκυθία, Ταῦροι. ",μετὰ, δὲ Θρᾴκην εἰσὶ
skylax_syntaxtrees_ud.conllu,26461,26463,ἔθνος καὶ πόλεις ,ἐν, αὐτοῖς Ἑλληνίδες αἵδε·
skylax_syntaxtrees_ud.conllu,26533,26536,"πόλις, Ὀφιοῦσα πόλις. ",ἐπὶ, δὲ τῇ Σκυθικῇ
skylax_syntaxtrees_ud.conllu,26598,26601,ἀκρωτήριον τῆς ἠπείρου· ,εἰς, θάλατταν δὲ τὸ
skylax_syntaxtrees_ud.conllu,26635,26637,τὸ ἀκρωτήριόν ἐστιν. ,ἐν, δὲ τῇ Ταυρικῇ
skylax_syntaxtrees_ud.conllu,26681,26683,"Ἕλληνες, καὶ πόλεις ",ἐν, αὐτοῖς αἵδε· Χερρόνησος
skylax_syntaxtrees_ud.conllu,26758,26762,ἀκρωτήριον τῆς Ταυρικῆς. ,μετὰ, δὲ ταῦτά εἰσι
skylax_syntaxtrees_ud.conllu,26816,26818,δὲ Ἑλληνίδες αἵδε ,ἐν," αὐτῇ· Θευδοσία, Κύταια"
skylax_syntaxtrees_ud.conllu,26897,26900,Μυρμήκιον. παράπλους εὐθὺς ,ἀπὸ, Ἴστρου ἐπὶ Κριοῦ
skylax_syntaxtrees_ud.conllu,26908,26911,εὐθὺς ἀπὸ Ἴστρου ,ἐπὶ, Κριοῦ Μέτωπον τριῶν
skylax_syntaxtrees_ud.conllu,26962,26966,"νυκτῶν, ὁ δὲ ",παρὰ, γῆν διπλάσιος· ἔστι
skylax_syntaxtrees_ud.conllu,26999,27001,ἔστι γὰρ κόλπος. ,ἐν, δὲ τῷ κόλπῳ
skylax_syntaxtrees_ud.conllu,27082,27085,ἱερὰ τοῦ Ἀχιλλέως. ,ἀπὸ, δὲ Κριοῦ Μετώπου
skylax_syntaxtrees_ud.conllu,27109,27112,Κριοῦ Μετώπου πλοῦς ,εἰς, Παντικάπαιον ἡμέρας καὶ
skylax_syntaxtrees_ud.conllu,27145,27148,ἡμέρας καὶ νυκτός· ,ἀπὸ, δὲ Παντικαπαίου ἐπὶ
skylax_syntaxtrees_ud.conllu,27165,27168,ἀπὸ δὲ Παντικαπαίου ,ἐπὶ, τὸ στόμα τῆς
skylax_syntaxtrees_ud.conllu,27242,27245,Μαιῶτις λίμνη λέγεται ,εἰς, ἥμισυ εἶναι τοῦ
skylax_syntaxtrees_ud.conllu,27270,27272,εἶναι τοῦ Πόντου. ,ἐν, δὲ τῇ Μαιώτιδι
skylax_syntaxtrees_ud.conllu,27317,27320,εὐθὺς εἰσπλέοντί εἰσιν ,ἐπ’, ἀριστερᾶς Σκύθαι· καθήκουσι
skylax_syntaxtrees_ud.conllu,27353,27355,Σκύθαι· καθήκουσι γὰρ ,ἐκ, τῆς ἔξω θαλάσσης
skylax_syntaxtrees_ud.conllu,27373,27377,τῆς ἔξω θαλάσσης ,ὑπὲρ, τῆς Ταυρικῆς εἰς
skylax_syntaxtrees_ud.conllu,27391,27394,ὑπὲρ τῆς Ταυρικῆς ,εἰς, τὴν Μαιῶτιν λίμνην
skylax_syntaxtrees_ud.conllu,27505,27508,ἁπάσης τῆς Εὐρώπης. ,ἀπὸ, Ἡρακλείων στηλῶν τῶν
skylax_syntaxtrees_ud.conllu,27530,27532,Ἡρακλείων στηλῶν τῶν ,ἐν, τῇ Εὐρώπῃ περιπλέοντι
skylax_syntaxtrees_ud.conllu,27568,27572,περιπλέοντι τοὺς κόλπους ,παρὰ," γῆν, λογιζομένῳ ὅσαι"
skylax_syntaxtrees_ud.conllu,27618,27622,γεγραμμέναι εἰσὶ νύκτες ,ἀντὶ," τούτων ἡμέρας, καὶ"
skylax_syntaxtrees_ud.conllu,27670,27674,στάδιά εἰσι γεγραμμένα ,ἀντὶ, τῶν φʹ σταδίων
skylax_syntaxtrees_ud.conllu,27816,27819,Μαιώτιδος λίμνης ἡμερῶν ,ρνʹ, τριῶν. μέγιστοι δὲ
skylax_syntaxtrees_ud.conllu,27853,27855,δὲ ποταμοί εἰσιν ,ἐν, τῇ Εὐρώπῃ ὁ
skylax_syntaxtrees_ud.conllu,27903,27906,ὁ Ῥοδανός. Ἀσία. ,ἀπὸ, Τανάϊδος δὲ ποταμοῦ
skylax_syntaxtrees_ud.conllu,27984,27986,ἔθνος αὐτῆς ἐστιν ,ἐν, τῷ Πόντῳ Σαυρομάται.
skylax_syntaxtrees_ud.conllu,28164,28167,γὰρ οὗτοι καὶ ,εἰς, τὸ ἔξω τῆς
skylax_syntaxtrees_ud.conllu,28171,28174,καὶ εἰς τὸ ,ἔξω, τῆς λίμνης· καί
skylax_syntaxtrees_ud.conllu,28203,28205,καί εἰσι πόλεις ,ἐν, αὐτοῖς Ἑλληνίδες αἵδε·
skylax_syntaxtrees_ud.conllu,28550,28554,Κορικὴ ἔθνος. Μελάγχλαινοι. ,μετὰ, δὲ Κορικὴν Μελάγχλαινοι
skylax_syntaxtrees_ud.conllu,28598,28600,"ἔθνος, καὶ ποταμὸς ",ἐν, αὐτοῖς Μητάσωρις καὶ
skylax_syntaxtrees_ud.conllu,28686,28690,Μελαγχλαίνους Γέλων. Κόλχοι. ,μετὰ, δὲ τούτους Κόλχοι
skylax_syntaxtrees_ud.conllu,28885,28888,πόλις· καὶ ἀνάπλους ,ἀνὰ, τὸν ποταμὸν σταδίων
skylax_syntaxtrees_ud.conllu,28913,28916,ποταμὸν σταδίων ρπʹ ,εἰς, πόλιν Αἶαν μεγάλην
skylax_syntaxtrees_ud.conllu,29045,29049,Ἄψαρος ποταμός. Βούσηρες. ,μετὰ, δὲ τοὺς Κόλχους
skylax_syntaxtrees_ud.conllu,29573,29577,ὄρη κατοικοῦσιν. Τιβαρηνοί. ,μετὰ, δὲ Μοσσυνοίκους ἔθνος
skylax_syntaxtrees_ud.conllu,30062,30066,πόλις Ἑλληνίς. Παφλαγονία. ,μετὰ, δ’ Ἀσσυρίαν ἐστὶ
skylax_syntaxtrees_ud.conllu,30110,30112,ἔθνος· ἔστι δ’ ,ἐν, αὐτῇ Στεφάνη λιμὴν
skylax_syntaxtrees_ud.conllu,30705,30707,τὸ προειρημένον Ἱερὸν ,ἐν, τῷ στόματι τοῦ
skylax_syntaxtrees_ud.conllu,30735,30739,"τοῦ Πόντου, καὶ ",μετὰ, τοῦτο πόλις Καλχηδὼν
skylax_syntaxtrees_ud.conllu,30761,30764,τοῦτο πόλις Καλχηδὼν ,ἔξω," τῆς Θρᾴκης, μεθ’"
skylax_syntaxtrees_ud.conllu,30777,30781,"ἔξω τῆς Θρᾴκης, ",μεθ’, ἣν ὁ κόλπος
skylax_syntaxtrees_ud.conllu,30816,30819,ὁ Ὀλβιανός. παράπλους ,ἀπὸ, Μαριανδυνῶν μέχρι τοῦ
skylax_syntaxtrees_ud.conllu,30832,30837,παράπλους ἀπὸ Μαριανδυνῶν ,μέχρι, τοῦ μυχοῦ τοῦ
skylax_syntaxtrees_ud.conllu,30922,30925,"Θρᾴκη, ἡμερῶν τριῶν. ",ἀπὸ, δὲ τοῦ στόματος
skylax_syntaxtrees_ud.conllu,30953,30956,στόματος τοῦ Πόντου ,ἕως, τὸ στόμα τῆς
skylax_syntaxtrees_ud.conllu,31019,31023,"πλοῦς, ὅ τε ",παρὰ, τὴν Εὐρώπην καὶ
skylax_syntaxtrees_ud.conllu,31058,31062,τὴν Ἀσίαν. Μυσία. ,μετὰ, δὲ Θρᾴκην Μυσία
skylax_syntaxtrees_ud.conllu,31097,31100,ἔστι δὲ τὸ ,ἐπ’, ἀριστερᾷ τοῦ Ὀλβιανοῦ
skylax_syntaxtrees_ud.conllu,31140,31143,Ὀλβιανοῦ κόλπου ἐκπλέοντι ,εἰς, τὸν Κιανὸν κόλπον
skylax_syntaxtrees_ud.conllu,31162,31167,τὸν Κιανὸν κόλπον ,μέχρι, Κίου. ἡ δὲ
skylax_syntaxtrees_ud.conllu,31206,31208,ἐστι. πόλεις δ’ ,ἐν, αὐτῇ Ἑλληνίδες εἰσὶν
skylax_syntaxtrees_ud.conllu,31309,31311,"Κιανοῦ κόλπου, καὶ ",ἐν, ἀριστερᾷ Κίος πόλις
skylax_syntaxtrees_ud.conllu,31374,31377,δὲ τῆς Μυσίας ,εἰς, Κίον ἡμέρας μιᾶς.
skylax_syntaxtrees_ud.conllu,31404,31408,ἡμέρας μιᾶς. Φρυγία. ,μετὰ, δὲ Μυσίαν Φρυγία
skylax_syntaxtrees_ud.conllu,31499,31502,Ῥύνδακος ποταμὸς καὶ ,ἐπ’," αὐτῷ Βέσβικος νῆσος,"
skylax_syntaxtrees_ud.conllu,31553,31555,Πλακία καὶ Κύζικος ,ἐν, τῷ ἰσθμῷ ἐμφράττουσα
skylax_syntaxtrees_ud.conllu,31593,31598,"τὸν ἰσθμόν, καὶ ",ἐντὸς, τοῦ ἰσθμοῦ Ἀρτάκη.
skylax_syntaxtrees_ud.conllu,31618,31622,τοῦ ἰσθμοῦ Ἀρτάκη. ,κατὰ, ταύτην νῆσός ἐστι
skylax_syntaxtrees_ud.conllu,31735,31737,δ’ αὐτὴν Προκοννήσιοι. ,ἐν, δὲ τῇ ἠπείρῳ
skylax_syntaxtrees_ud.conllu,31819,31823,καὶ τὸ στόμα ,κατὰ, Σηστὸν τῆς Προποντίδος
skylax_syntaxtrees_ud.conllu,31920,31922,πόλεις Ἑλληνίδες εἰσὶν ,ἐν," αὐτῇ αἵδε· Δάρδανος,"
skylax_syntaxtrees_ud.conllu,31971,31974,Ἴλιον· ἀπέχει δὲ ,ἀπὸ, τῆς θαλάττης στάδια
skylax_syntaxtrees_ud.conllu,32004,32006,στάδια κεʹ· καὶ ,ἐν, αὐτῷ ποταμὸς Σκάμανδρος.
skylax_syntaxtrees_ud.conllu,32042,32046,Σκάμανδρος. καὶ νῆσος ,κατὰ, ταῦτα κεῖται Τένεδος
skylax_syntaxtrees_ud.conllu,32120,32122,ἀστρόλογός ἐστιν. καὶ ,ἐν, τῇ ἠπείρῳ Σίγη
skylax_syntaxtrees_ud.conllu,32301,32303,Αἰολίδες δὲ πόλεις ,ἐν, αὐτῇ εἰσὶν ἐπὶ
skylax_syntaxtrees_ud.conllu,32315,32318,ἐν αὐτῇ εἰσὶν ,ἐπὶ," θαλάττῃ αἵδε· Ἄσσος,"
skylax_syntaxtrees_ud.conllu,32360,32362,"Ἄσσος, Γάργαρα, Ἄντανδρος. ",ἐν, μεσογείᾳ δὲ αἵδε·
skylax_syntaxtrees_ud.conllu,32435,32438,Πιτύεια. παράπλους Φρυγίας ,ἀπὸ, Μυσίας μέχρι Ἀντάνδρου
skylax_syntaxtrees_ud.conllu,32446,32451,Φρυγίας ἀπὸ Μυσίας ,μέχρι, Ἀντάνδρου —. Λέσβος.
skylax_syntaxtrees_ud.conllu,32473,32477,Ἀντάνδρου —. Λέσβος. ,κατὰ, ταῦτά ἐστι νῆσος
skylax_syntaxtrees_ud.conllu,32527,32529,εʹ πόλεις ἔχουσα ,ἐν," αὑτῇ τάσδε· Μήθυμναν,"
skylax_syntaxtrees_ud.conllu,32620,32624,λιμένας ἔχουσαν δύο. ,κατὰ, δὲ ταύτην νῆσός
skylax_syntaxtrees_ud.conllu,32703,32706,ἐπάνειμι δὲ πάλιν ,ἐπὶ," τὴν ἤπειρον, ὅθεν"
skylax_syntaxtrees_ud.conllu,32737,32740,"ἤπειρον, ὅθεν ἐξετραπόμην ",ἐπὶ, τὰς νήσους. Λυδία.
skylax_syntaxtrees_ud.conllu,32760,32763,τὰς νήσους. Λυδία. ,ἀπὸ, Ἀντάνδρου καὶ τῆς
skylax_syntaxtrees_ud.conllu,32837,32842,ἡ χώρα Μυσία ,μέχρι," Τευθρανίας, νῦν δὲ"
skylax_syntaxtrees_ud.conllu,32890,32893,Μυσοὶ δ’ ἐξανέστησαν ,εἰς, τὴν ἤπειρον ἄνω.
skylax_syntaxtrees_ud.conllu,32926,32928,εἰσὶ δὲ πόλεις ,ἐν, αὐτῇ Ἑλληνίδες καὶ
skylax_syntaxtrees_ud.conllu,32948,32950,αὐτῇ Ἑλληνίδες καὶ ,ἐν, τῇ Λυδίᾳ αἵδε·
skylax_syntaxtrees_ud.conllu,33014,33018,"Ἀρτέμιδος, καὶ Ἀδραμύττιον. ",μετὰ, δὲ Ἀδραμύττιον ἡ
skylax_syntaxtrees_ud.conllu,33053,33057,χώρα Λεσβία· καὶ ,ὑπὲρ, ταύτης ἡ Χίων
skylax_syntaxtrees_ud.conllu,33097,33100,καὶ πόλις Ἀταρνεύς· ,ὑπὸ, δὲ ταῦτα ἐπὶ
skylax_syntaxtrees_ud.conllu,33110,33113,ὑπὸ δὲ ταῦτα ,ἐπὶ, θάλατταν πόλις καὶ
skylax_syntaxtrees_ud.conllu,33166,33170,καὶ ποταμὸς Κάϊκος. ,μετὰ," Πιτάνην Ἐλαία, Γρύνειον,"
skylax_syntaxtrees_ud.conllu,33210,33212,"Γρύνειον, Ἀχαιῶν Λιμήν· ",ἐν, τούτῳ λέγονται Ἀχαιοὶ
skylax_syntaxtrees_ud.conllu,33248,33251,λέγονται Ἀχαιοὶ βουλεύσασθαι ,ἐπὶ, τὸν Τήλεφον πότερον
skylax_syntaxtrees_ud.conllu,33335,33339,Κύμη καὶ λιμήν· ,ὑπὲρ, δὲ Κύμης ἐν
skylax_syntaxtrees_ud.conllu,33349,33351,ὑπὲρ δὲ Κύμης ,ἐν, μεσογείᾳ πόλις Ἑλληνίς
skylax_syntaxtrees_ud.conllu,33423,33425,"λιμένες καὶ Σμύρνα, ",ἐν," ᾗ Ὅμηρος ἦν,"
skylax_syntaxtrees_ud.conllu,33516,33520,Ἐρυθραὶ καὶ λιμήν. ,κατὰ, δὲ ταύτας νῆσός
skylax_syntaxtrees_ud.conllu,33573,33576,λιμήν. ἐπάνειμι πάλιν ,ἐπὶ, τὴν ἤπειρον. Αἰραὶ
skylax_syntaxtrees_ud.conllu,33652,33654,"λιμήν, Λέβεδος, Κολοφὼν ",ἐν," μεσογαίᾳ, Νότιον καὶ"
skylax_syntaxtrees_ud.conllu,33759,33761,"λιμήν, Μαραθήσιον καὶ ",ἐν, τῇ ἠπείρῳ Μαγνησία
skylax_syntaxtrees_ud.conllu,33866,33868,"Φώκαια, Ἀκαδαμίς, Μυκάλη· ",ἐν, τῇ Σαμίων χώρᾳ
skylax_syntaxtrees_ud.conllu,33897,33900,χώρᾳ ταῦτά ἐστιν. ,πρὸ, δὲ τῆς Μυκάλης
skylax_syntaxtrees_ud.conllu,34021,34024,ἐπάνειμι δὲ πάλιν ,ἐπὶ," τὴν ἤπειρον, ὅθεν"
skylax_syntaxtrees_ud.conllu,34056,34059,"ἤπειρον, ὅθεν ἐξετραπόμην. ",ἐπὶ, τῆς Μυκάλης ἐστὶ
skylax_syntaxtrees_ud.conllu,34187,34190,"Μυσίας καὶ Λυδίας, ",ἀπὸ, Ἀστύρων μέχρι Μαιάνδρου
skylax_syntaxtrees_ud.conllu,34199,34204,"Λυδίας, ἀπὸ Ἀστύρων ",μέχρι," Μαιάνδρου ποταμοῦ, δύο"
skylax_syntaxtrees_ud.conllu,34259,34263,νυκτὸς μιᾶς. Καρία. ,μετὰ, δὲ Λυδίαν Καρία
skylax_syntaxtrees_ud.conllu,34304,34306,"ἔθνος, καὶ πόλεις ",ἐν, αὐτῇ Ἑλληνίδες αἵδε·
skylax_syntaxtrees_ud.conllu,34423,34427,καὶ ἄλλος λιμὴν ,περὶ, τὴν νῆσον καὶ
skylax_syntaxtrees_ud.conllu,34555,34559,καὶ λιμὴν κλειστός. ,κατὰ, ταῦτα Κεραμιακὸς κόλπος
skylax_syntaxtrees_ud.conllu,34640,34643,λιμήν. ἐπάνειμι πάλιν ,ἐπὶ, τὴν ἤπειρον. ἀκρωτήριον
skylax_syntaxtrees_ud.conllu,34737,34739,ἡ Ῥοδίων ἡ ,ἐν," τῇ ἠπείρῳ, Καῦνος"
