document name,begin offset,end offset,context left,text,context right
skylax_syntaxtrees_perseus.conllu,50407,50410,· ἐπικλύζει δὲ ,ἐπ’, αὐτὰ ἐνιαχῆ.
skylax_syntaxtrees_perseus.conllu,50443,50446,δὲ τὸ ἕρμα ,ἐπὶ, ἑτέραν ἄκραν τῆς
skylax_syntaxtrees_perseus.conllu,50528,50531,Ἱερὸν Ἀκρωτήριον. ,ἀπὸ, δὲ τῆς Ἑρμαίας
skylax_syntaxtrees_perseus.conllu,50591,50594,ἐξίησι δὲ οὗτος ,εἰς, λίμνην μεγάλην.
skylax_syntaxtrees_perseus.conllu,50611,50615,λίμνην μεγάλην. ,μετὰ, δὲ Ἀνίδην εἶτα
skylax_syntaxtrees_perseus.conllu,50719,50724,πόλις Λιβύων ἐστὶ ,πέραν," τοῦ ποταμοῦ,"
skylax_syntaxtrees_perseus.conllu,50749,50753,καὶ λιμήν. ,μετὰ, δὲ Λίξον Κράβις
skylax_syntaxtrees_perseus.conllu,50826,50829,Θυμιατηρία ὄνομα. ,ἀπὸ, Θυμιατηρίας πλοῦς εἰς
skylax_syntaxtrees_perseus.conllu,50848,50851,ἀπὸ Θυμιατηρίας πλοῦς ,εἰς," Σολόεσαν ἄκραν,"
skylax_syntaxtrees_perseus.conllu,50885,50888,ἣ ἀνέχει μάλιστα ,εἰς, τὸν πόντον.
skylax_syntaxtrees_perseus.conllu,50960,50963,καὶ ἱερωτάτη. ,ἐπὶ, δὲ τῷ ἀκρωτηρίῳ
skylax_syntaxtrees_perseus.conllu,51028,51030,μεγαλοπρεπὴς Ποσειδῶνος. ,ἐν, δὲ τῷ βωμῷ
skylax_syntaxtrees_perseus.conllu,51116,51119,φασι ποιῆσαι. ,ἀπὸ, δὲ Σολόεντος ἄκρας
skylax_syntaxtrees_perseus.conllu,51167,51171,ὄνομα Ξιῶν. ,περὶ, τοῦτον τὸν ποταμὸν
skylax_syntaxtrees_perseus.conllu,51220,51224,Αἰθίοπες ἱεροί. ,κατὰ, δὲ ταῦτα νῆσός
skylax_syntaxtrees_perseus.conllu,51274,51277,. παράπλους δὲ ,ἀπὸ, Ἡρακλείων στηλῶν ἐπὶ
skylax_syntaxtrees_perseus.conllu,51295,51298,ἀπὸ Ἡρακλείων στηλῶν ,ἐπὶ, Ἑρμαίαν ἄκραν ἡμερῶν
skylax_syntaxtrees_perseus.conllu,51325,51328,ἡμερῶν δύο. ,ἀπὸ, δὲ Ἑρμαίας ἄκρας
skylax_syntaxtrees_perseus.conllu,51346,51349,δὲ Ἑρμαίας ἄκρας ,εἰς, Σολόεντα ἄκραν παράπλους
skylax_syntaxtrees_perseus.conllu,51389,51392,ἡμερῶν τριῶν. ,ἀπὸ, δὲ Σολόεντος εἰς
skylax_syntaxtrees_perseus.conllu,51406,51409,ἀπὸ δὲ Σολόεντος ,εἰς, Κέρνην παράπλους ἡμερῶν
skylax_syntaxtrees_perseus.conllu,51474,51477,παράπλους οὗτός ἐστιν ,ἀπὸ, Ἡρακλείων στηλῶν εἰς
skylax_syntaxtrees_perseus.conllu,51495,51498,ἀπὸ Ἡρακλείων στηλῶν ,εἰς, Κέρνην νῆσον ἡμερῶν
skylax_syntaxtrees_perseus.conllu,51577,51580,οὐκέτι ἐστὶ πλωτὰ ,διὰ, βραχύτητα θαλάττης καὶ
skylax_syntaxtrees_perseus.conllu,51739,51742,ἐπὰν δὲ ἀφίκωνται ,εἰς, τὴν νῆσον τὴν
skylax_syntaxtrees_perseus.conllu,51796,51798,"γαύλους καθορμίζουσι, ",ἐν, τῇ Κέρνῃ σκηνὰς
skylax_syntaxtrees_perseus.conllu,51880,51882,ἐξελόμενοι αὐτοὶ διακομίζουσιν ,ἐν, μικροῖς πλοίοις εἰς
skylax_syntaxtrees_perseus.conllu,51899,51902,ἐν μικροῖς πλοίοις ,εἰς, τὴν ἤπειρον.
skylax_syntaxtrees_perseus.conllu,51939,51943,δὲ οὗτοι Αἰθίοπες ,πρὸς, τὴν ἤπειρον·
skylax_syntaxtrees_perseus.conllu,51983,51987,οὗτοι οἱ Αἰθίοπες ,πρὸς, οὓς διατίθενται.
skylax_syntaxtrees_perseus.conllu,52016,52020,. πωλοῦσι δὲ ,πρὸς, δέρματα ἐλάφων καὶ
skylax_syntaxtrees_perseus.conllu,52272,52276,χρῶνται δὲ καὶ ,πρὸς, τοὺς ἵππους ἐλεφαντίνῳ
skylax_syntaxtrees_perseus.conllu,52779,52781,πλάσματά ἐστιν ὤνια ,ἐν, τοῖς Χουσὶ τῇ
skylax_syntaxtrees_perseus.conllu,52876,52879,δὲ ποιοῦσι πολὺν ,ἀπὸ, ἀμπέλων· τὸν
skylax_syntaxtrees_perseus.conllu,52960,52964,"πόλις μεγάλη, ",πρὸς, ἣν οἱ Φοίνικες
skylax_syntaxtrees_perseus.conllu,53079,53082,συνεχῶς οἰκοῦντας ἐντεῦθεν ,εἰς," Αἴγυπτον, καὶ"
skylax_syntaxtrees_perseus.conllu,53168,53171,Λιβύην. διάφραγμα ,διὰ, τῆς θαλάττης ἀπὸ
skylax_syntaxtrees_perseus.conllu,53185,53188,διὰ τῆς θαλάττης ,ἀπὸ, τῆς Εὐρώπης εἰς
skylax_syntaxtrees_perseus.conllu,53201,53204,ἀπὸ τῆς Εὐρώπης ,εἰς, τὴν Ἀσίαν ἐπιεικῶς
skylax_syntaxtrees_perseus.conllu,53229,53233,Ἀσίαν ἐπιεικῶς εὐθὺ ,κατ’, ὀρθόν. ἄρχεται
skylax_syntaxtrees_perseus.conllu,53265,53268,δὲ τὸ διάφραγμα ,ἀπὸ, Εὐρίπου τοῦ κατὰ
skylax_syntaxtrees_perseus.conllu,53281,53285,ἀπὸ Εὐρίπου τοῦ ,κατὰ," Χαλκίδα, καὶ"
skylax_syntaxtrees_perseus.conllu,53305,53308,", καὶ ἔστιν ",ἐπὶ, Γεραιστὸν στάδια ψʹ
skylax_syntaxtrees_perseus.conllu,53337,53340,καὶ νʹ. ,ἀπὸ, Γεραιστοῦ ἐπὶ Παιώνιον
skylax_syntaxtrees_perseus.conllu,53351,53354,. ἀπὸ Γεραιστοῦ ,ἐπὶ, Παιώνιον τῆς Ἄνδρου
skylax_syntaxtrees_perseus.conllu,53403,53406,αὐτῆς τῆς Ἄνδρου ,ἐπὶ, τὸν Αὐλῶνα στάδια
skylax_syntaxtrees_perseus.conllu,53451,53454,τοῦ Αὐλῶνος διάπλους ,εἰς, Τῆνον στάδια ιβʹ
skylax_syntaxtrees_perseus.conllu,53492,53495,δὲ τῆς Τήνου ,ἐπὶ, τὸ ἀκρωτήριον τὸ
skylax_syntaxtrees_perseus.conllu,53513,53517,τὸ ἀκρωτήριον τὸ ,κατὰ, Ῥηναίαν στάδια ρνʹ
skylax_syntaxtrees_perseus.conllu,53553,53556,τοῦ δὲ διάπλου ,εἰς, Ῥηναίαν στάδια μʹ
skylax_syntaxtrees_perseus.conllu,53609,53612,καὶ τοῦ διάπλου ,εἰς, Μύκονον στάδια μʹ
skylax_syntaxtrees_perseus.conllu,53632,53635,στάδια μʹ. ,ἀπὸ, δὲ Μυκόνου διάπλους
skylax_syntaxtrees_perseus.conllu,53656,53659,δὲ Μυκόνου διάπλους ,ἐπὶ, τοὺς Μελαντίους σκοπέλους
skylax_syntaxtrees_perseus.conllu,53727,53730,σταδίων μʹ. ,ἀπὸ, δὲ Μελαντίων σκοπέλων
skylax_syntaxtrees_perseus.conllu,53759,53762,Μελαντίων σκοπέλων πλοῦς ,εἰς, Ἴκαρον προαριστίδιος.
skylax_syntaxtrees_perseus.conllu,53815,53818,Ἰκάρου στάδια τʹ ,ἐπὶ, μῆκος. ἀπὸ
skylax_syntaxtrees_perseus.conllu,53826,53829,ἐπὶ μῆκος. ,ἀπὸ, δὲ Ἰκάρου πλοῦς
skylax_syntaxtrees_perseus.conllu,53846,53849,δὲ Ἰκάρου πλοῦς ,εἰς, Σάμον προαριστίδιος.
skylax_syntaxtrees_perseus.conllu,53897,53899,στάδια σʹ. ,ἐκ, Σάμου εἰς Μυκάλην
skylax_syntaxtrees_perseus.conllu,53906,53909,. ἐκ Σάμου ,εἰς, Μυκάλην τοῦ διάπλου
skylax_syntaxtrees_perseus.conllu,53953,53955,"πᾶν, ἐὰν ",ἐκ, Σάμου πλέωσι πλῷ
skylax_syntaxtrees_perseus.conllu,54027,54029,τοῦ πλοῦ τοῦ ,ἐκ, Μυκάλης εἰς Σάμον
skylax_syntaxtrees_perseus.conllu,54038,54041,τοῦ ἐκ Μυκάλης ,εἰς, Σάμον. ἕτερον
skylax_syntaxtrees_perseus.conllu,54072,54076,ἕτερον διάφραγμα ὀρθὸν ,κατ’, εὐθύ. ἀπὸ
skylax_syntaxtrees_perseus.conllu,54083,54086,κατ’ εὐθύ. ,ἀπὸ, Μαλέας ἕως Κυθήρων
skylax_syntaxtrees_perseus.conllu,54094,54097,. ἀπὸ Μαλέας ,ἕως, Κυθήρων στάδια ρλʹ
skylax_syntaxtrees_perseus.conllu,54152,54155,στάδια ρʹ. ,εἰς, Αἰγιλίαν πλοῦς προαριστίδιος
skylax_syntaxtrees_perseus.conllu,54218,54221,στάδια νʹ. ,ἀπ’, Αἰγιλίας εἰς Κρήτην
skylax_syntaxtrees_perseus.conllu,54231,54234,. ἀπ’ Αἰγιλίας ,εἰς," Κρήτην, πλοῦς"
skylax_syntaxtrees_perseus.conllu,54296,54299,στάδια ͵βφʹ. ,ἀπὸ, Κρήτης εἰς Κάρπαθον
skylax_syntaxtrees_perseus.conllu,54307,54310,. ἀπὸ Κρήτης ,εἰς, Κάρπαθον στάδια †ρʹ
skylax_syntaxtrees_perseus.conllu,54364,54367,στάδια ρʹ. ,εἰς, Ῥόδον ἀπὸ Καρπάθου
skylax_syntaxtrees_perseus.conllu,54374,54377,. εἰς Ῥόδον ,ἀπὸ, Καρπάθου πλοῦς στάδια
skylax_syntaxtrees_perseus.conllu,54433,54436,στάδια χʹ. ,ἀπὸ, Ῥόδου εἰς τὴν
skylax_syntaxtrees_perseus.conllu,54443,54446,. ἀπὸ Ῥόδου ,εἰς, τὴν Ἀσίαν στάδια
,,,,,
skylax_syntaxtrees_ud.conllu,19,22,Εὐρώπη. ἄρξομαι δὲ ,ἀπὸ, Ἡρακλείων στηλῶν τῶν
skylax_syntaxtrees_ud.conllu,44,46,Ἡρακλείων στηλῶν τῶν ,ἐν, τῇ Εὐρώπῃ μέχρι
skylax_syntaxtrees_ud.conllu,57,62,ἐν τῇ Εὐρώπῃ ,μέχρι, Ἡρακλείων στηλῶν τῶν
skylax_syntaxtrees_ud.conllu,84,86,Ἡρακλείων στηλῶν τῶν ,ἐν," τῇ Λιβύῃ, καὶ"
skylax_syntaxtrees_ud.conllu,101,106,"τῇ Λιβύῃ, καὶ ",μέχρι, Αἰθιόπων τῶν μεγάλων.
skylax_syntaxtrees_ud.conllu,212,215,ἀλλήλων πλοῦν ἡμέρας. ,ἀπὸ, Ἡρακλείων στηλῶν τῶν
skylax_syntaxtrees_ud.conllu,237,239,Ἡρακλείων στηλῶν τῶν ,ἐν, τῇ Εὐρώπῃ ἐμπόρια
skylax_syntaxtrees_ud.conllu,484,487,ἀπέχουσαν ἡμέρας πλοῦν ,ἀπὸ, Ἡρακλείων στηλῶν. εἶτα
skylax_syntaxtrees_ud.conllu,661,664,Λίγυες καὶ Ἴβηρες. ,ἀπὸ, δὲ Ἰβήρων ἔχονται
skylax_syntaxtrees_ud.conllu,709,714,καὶ Ἴβηρες μιγάδες ,μέχρι, ποταμοῦ Ῥοδανοῦ. παράπλους
skylax_syntaxtrees_ud.conllu,749,752,Ῥοδανοῦ. παράπλους Λιγύων ,ἀπὸ, Ἐμπορίου μέχρι Ῥοδανοῦ
skylax_syntaxtrees_ud.conllu,762,767,Λιγύων ἀπὸ Ἐμπορίου ,μέχρι, Ῥοδανοῦ ποταμοῦ δύο
skylax_syntaxtrees_ud.conllu,820,823,μιᾶς νυκτός. Λίγυες. ,ἀπὸ, Ῥοδανοῦ ποταμοῦ ἔχονται
skylax_syntaxtrees_ud.conllu,855,860,ποταμοῦ ἔχονται Λίγυες ,μέχρι, Ἀντίου. ἐν ταύτῃ
skylax_syntaxtrees_ud.conllu,869,871,Λίγυες μέχρι Ἀντίου. ,ἐν, ταύτῃ τῇ χώρᾳ
skylax_syntaxtrees_ud.conllu,1016,1019,δ’ ἐστὶ ταύτης ,ἀπὸ, Ῥοδανοῦ ποταμοῦ μέχρι
skylax_syntaxtrees_ud.conllu,1036,1041,ἀπὸ Ῥοδανοῦ ποταμοῦ ,μέχρι, Ἀντίου ἡμερῶν δύο
skylax_syntaxtrees_ud.conllu,1076,1079,καὶ νυκτῶν δύο. ,ἀπὸ, δὲ Ἡρακλείων στηλῶν
skylax_syntaxtrees_ud.conllu,1100,1105,δὲ Ἡρακλείων στηλῶν ,μέχρι, Ἀντίου ἡ χώρα
skylax_syntaxtrees_ud.conllu,1151,1154,αὕτη εὐλίμενος. Τυρρηνοί. ,ἀπὸ, δὲ Ἀντίου Τυρρηνοὶ
skylax_syntaxtrees_ud.conllu,1180,1185,Ἀντίου Τυρρηνοὶ ἔθνος ,μέχρι, Ῥώμης πόλεως. παράπλους
skylax_syntaxtrees_ud.conllu,1255,1259,νυκτῶν τεσσάρων. Κύρνος. ,κατὰ, δὲ Τυρρηνίαν κεῖται
skylax_syntaxtrees_ud.conllu,1302,1305,Κύρνος. ἔστι δὲ ,ἀπὸ, Τυρρηνίας ὁ πλοῦς
skylax_syntaxtrees_ud.conllu,1324,1327,Τυρρηνίας ὁ πλοῦς ,εἰς, Κύρνον ἡμέρας καὶ
skylax_syntaxtrees_ud.conllu,1365,1367,ἡμίσεως. καὶ νῆσος ,ἐν, μέσῳ τῷ πλῷ
skylax_syntaxtrees_ud.conllu,1451,1454,ἔρημοι νῆσοι. Σαρδώ. ,ἀπὸ, δὲ Κύρνου νήσου
skylax_syntaxtrees_ud.conllu,1471,1474,δὲ Κύρνου νήσου ,εἰς, Σαρδὼ νῆσον πλοῦς
skylax_syntaxtrees_ud.conllu,1530,1532,καὶ νῆσος ἐρήμη ,ἐν, τῷ μεταξύ. ἀπὸ
skylax_syntaxtrees_ud.conllu,1544,1547,ἐν τῷ μεταξύ. ,ἀπὸ, Σαρδοῦς δὲ εἰς
skylax_syntaxtrees_ud.conllu,1559,1562,ἀπὸ Σαρδοῦς δὲ ,εἰς, Λιβύην πλοῦς ἡμέρας
skylax_syntaxtrees_ud.conllu,1595,1598,ἡμέρας καὶ νυκτός. ,εἰς, δὲ Σικελίαν ἀπὸ
skylax_syntaxtrees_ud.conllu,1611,1614,εἰς δὲ Σικελίαν ,ἀπὸ, Σαρδοῦς πλοῦς ἡμερῶν
skylax_syntaxtrees_ud.conllu,1670,1673,ἐπάνειμι δὲ πάλιν ,ἐπὶ," τὴν ἤπειρον, ὅθεν"
skylax_syntaxtrees_ud.conllu,1692,1695,"τὴν ἤπειρον, ὅθεν ",εἰς, τὴν Κύρνον ἐξετραπόμην.
skylax_syntaxtrees_ud.conllu,1755,1760,Τυρρηνίας ἔχονται Λατῖνοι ,μέχρι, τοῦ Κιρκαίου. καὶ
skylax_syntaxtrees_ud.conllu,1987,1989,πόλεις Ἑλληνίδες αὗται ,ἐν," τῇ Καμπανίᾳ· Κύμη,"
skylax_syntaxtrees_ud.conllu,2019,2023,"Καμπανίᾳ· Κύμη, Νεάπολις. ",κατὰ, ταῦτά ἐστι Πιθηκοῦσσα
skylax_syntaxtrees_ud.conllu,2238,2243,δὲ ἔχονται Λευκανοὶ ,μέχρι, Θουρίας. ὁ πλοῦς
skylax_syntaxtrees_ud.conllu,2269,2273,πλοῦς δέ ἐστι ,παρὰ, Λευκανίαν ἡμερῶν ϛʹ
skylax_syntaxtrees_ud.conllu,2291,2293,παρὰ Λευκανίαν ἡμερῶν ,ϛʹ, καὶ νυκτῶν ϛʹ.
skylax_syntaxtrees_ud.conllu,2335,2337,Λευκανία ἐστὶν ἀκτή. ,ἐν, ταύτῃ πόλεις εἰσὶν
skylax_syntaxtrees_ud.conllu,2501,2505,καὶ πόλις. Σικελία. ,κατὰ, δὲ Ῥήγιόν ἐστι
skylax_syntaxtrees_ud.conllu,2536,2539,"ἐστι Σικελία νῆσος, ",ἀπὸ, τῆς Εὐρώπης ἀπέχουσα
skylax_syntaxtrees_ud.conllu,2572,2575,ἀπέχουσα στάδια ιβʹ ,ἐπὶ, Πελωριάδα ἀπὸ Ῥηγίου.
skylax_syntaxtrees_ud.conllu,2586,2589,ιβʹ ἐπὶ Πελωριάδα ,ἀπὸ, Ῥηγίου. ἐν δὲ
skylax_syntaxtrees_ud.conllu,2598,2600,Πελωριάδα ἀπὸ Ῥηγίου. ,ἐν, δὲ Σικελίᾳ ἔθνη
skylax_syntaxtrees_ud.conllu,2773,2776,πόλεις δ’ εἰσὶν ,ἀπὸ, Πελωριάδος Ἑλληνίδες αἵδε·
skylax_syntaxtrees_ud.conllu,2862,2865,"Νάξος, Κατάνη, Λεοντῖνοι· ",εἰς, τοὺς Λεοντίνους δὲ
skylax_syntaxtrees_ud.conllu,2885,2889,τοὺς Λεοντίνους δὲ ,κατὰ, Τηρίαν ποταμὸν ἀνάπλους
skylax_syntaxtrees_ud.conllu,2914,2916,Τηρίαν ποταμὸν ἀνάπλους ,κʹ, σταδίων. Σύμαιθος ποταμὸς
skylax_syntaxtrees_ud.conllu,3038,3040,"Συράκουσαι, καὶ λιμένες ",ἐν, αὐτῇ δύο· τούτων
skylax_syntaxtrees_ud.conllu,3067,3072,τούτων ὁ ἕτερος ,ἐντὸς," τείχους, ὁ δ’"
skylax_syntaxtrees_ud.conllu,3098,3102,δ’ ἄλλος ἔξω. ,μετὰ, δὲ ταύτην πόλις
skylax_syntaxtrees_ud.conllu,3150,3153,καὶ Πάχυνος ἀκρωτήριον. ,ἀπὸ, Παχύνου δὲ πόλεις
skylax_syntaxtrees_ud.conllu,3245,3248,"Σελινοῦς, Λιλύβαιον ἀκρωτήριον. ",ἀπὸ, δὲ Λιλυβαίου πόλις
skylax_syntaxtrees_ud.conllu,3370,3374,μάλιστα σταδίων ͵αφʹ. ,μετὰ, δὲ Ἱμέραν πόλιν
skylax_syntaxtrees_ud.conllu,3453,3456,λιμήν. ἔστι δὲ ,ἀπὸ, Μυλῶν ἐπὶ Λιπάραν
skylax_syntaxtrees_ud.conllu,3463,3466,δὲ ἀπὸ Μυλῶν ,ἐπὶ, Λιπάραν νῆσον πλοῦς
skylax_syntaxtrees_ud.conllu,3519,3522,ἐπάνειμι δὲ πάλιν ,ἐπὶ," τὴν ἤπειρον, ὅθεν"
skylax_syntaxtrees_ud.conllu,3554,3557,"ἤπειρον, ὅθεν ἐξετραπόμην. ",ἀπὸ, γὰρ Ῥηγίου πόλεις
skylax_syntaxtrees_ud.conllu,3654,3656,"καὶ νῆσος Καλυψοῦς, ",ἐν, ᾗ Ὀδυσσεὺς ᾤκει
skylax_syntaxtrees_ud.conllu,3673,3677,ᾗ Ὀδυσσεὺς ᾤκει ,παρὰ," Καλυψοῖ, καὶ ποταμὸς"
skylax_syntaxtrees_ud.conllu,3743,3745,Θουρία πόλις. οὗτοι ,ἐν, τῇ Λευκανίᾳ Ἕλληνες.
skylax_syntaxtrees_ud.conllu,3776,3780,Λευκανίᾳ Ἕλληνες. Ἰαπυγία. ,μετὰ, δὲ τὴν Λευκανίαν
skylax_syntaxtrees_ud.conllu,3818,3823,Ἰάπυγές εἰσιν ἔθνος ,μέχρι, Ὑρίωνος ὄρους τοῦ
skylax_syntaxtrees_ud.conllu,3842,3844,Ὑρίωνος ὄρους τοῦ ,ἐν, τῷ κόλπῳ τῷ
skylax_syntaxtrees_ud.conllu,3874,3878,τῷ Ἀδρίᾳ. παράπλους ,παρὰ, τὴν Ἰαπυγίαν ἓξ
skylax_syntaxtrees_ud.conllu,3917,3919,καὶ ἓξ νυκτῶν. ,ἐν, δὲ τῇ Ἰαπυγίᾳ
skylax_syntaxtrees_ud.conllu,4023,4026,"καὶ λιμήν, Ὑδροῦς ",ἐπὶ, τῷ τοῦ Ἀδρίου
skylax_syntaxtrees_ud.conllu,4099,4102,μετὰ δὲ Ἰάπυγας ,ἀπὸ, Ὑρίωνος Δαυνῖται ἔθνος
skylax_syntaxtrees_ud.conllu,4133,4135,Δαυνῖται ἔθνος ἐστίν. ,ἐν, δὲ τούτῳ τῷ
skylax_syntaxtrees_ud.conllu,4247,4250,"Βορεοντῖνοι, Πευκετιεῖς διήκοντες ",ἀπὸ, δὲ τοῦ Τυρσηνικοῦ
skylax_syntaxtrees_ud.conllu,4278,4281,τοῦ Τυρσηνικοῦ πελάγους ,εἰς, τὸν Ἀδρίαν. παράπλους
skylax_syntaxtrees_ud.conllu,4407,4409,"Ὀμβρικοί, καὶ πόλις ",ἐν, αὐτοῖς Ἀγκών ἐστι.
skylax_syntaxtrees_ud.conllu,4474,4477,"τιμᾷ Διομήδην, εὐεργετηθὲν ",ὑπ’, αὐτοῦ· καὶ ἱερόν
skylax_syntaxtrees_ud.conllu,4573,4577,καὶ νυκτός. Τυρρηνοί. ,μετὰ, δὲ τὸ Ὀμβρικὸν
skylax_syntaxtrees_ud.conllu,4625,4628,δὲ καὶ οὗτοι ,ἀπὸ, τοῦ Τυρρηνικοῦ πελάγους
skylax_syntaxtrees_ud.conllu,4660,4663,Τυρρηνικοῦ πελάγους ἔξωθεν ,εἰς, τὸν Ἀδρίαν κόλπον.
skylax_syntaxtrees_ud.conllu,4693,4695,κόλπον. καὶ πόλις ,ἐν, αὐτοῖς Ἑλληνὶς Σπῖνα
skylax_syntaxtrees_ud.conllu,4743,4746,ποταμός· καὶ ἀνάπλους ,εἰς, τὴν πόλιν κατὰ
skylax_syntaxtrees_ud.conllu,4757,4761,εἰς τὴν πόλιν ,κατὰ, ποταμὸν ὡς εἴκοσι
skylax_syntaxtrees_ud.conllu,4817,4820,Τυρρηνία ἐστὶν διήκουσα ,ἀπὸ, τῆς ἔξωθεν θαλάττης
skylax_syntaxtrees_ud.conllu,4841,4844,τῆς ἔξωθεν θαλάττης ,ἕως, εἰς τὸν Ἀδρίαν
skylax_syntaxtrees_ud.conllu,4845,4848,ἔξωθεν θαλάττης ἕως ,εἰς, τὸν Ἀδρίαν κόλπον.
skylax_syntaxtrees_ud.conllu,4902,4905,παράπλους ἡμέρας μιᾶς ,ἀπὸ, †πόλεων πόλεως· καὶ
skylax_syntaxtrees_ud.conllu,5025,5028,"ἀπολειφθέντες τῆς στρατείας, ",ἐπὶ," στενῶν μέχρι Ἀδρίου,"
skylax_syntaxtrees_ud.conllu,5036,5041,"στρατείας, ἐπὶ στενῶν ",μέχρι," Ἀδρίου, διήκοντες ἀπὸ"
skylax_syntaxtrees_ud.conllu,5060,5063,"μέχρι Ἀδρίου, διήκοντες ",ἀπὸ, τῆς ἔξωθεν θαλάττης
skylax_syntaxtrees_ud.conllu,5084,5087,τῆς ἔξωθεν θαλάττης ,ἕως, εἰς τὸν Ἀδρίαν
skylax_syntaxtrees_ud.conllu,5088,5091,ἔξωθεν θαλάττης ἕως ,εἰς, τὸν Ἀδρίαν κόλπον.
skylax_syntaxtrees_ud.conllu,5220,5222,καὶ ποταμὸς Ἠριδανὸς ,ἐν, αὐτοῖς. Ἐνετῶν δὲ
skylax_syntaxtrees_ud.conllu,5257,5260,δὲ παράπλους ἐστὶν ,ἐπ’, εὐθείας ἀπὸ Πίσης
skylax_syntaxtrees_ud.conllu,5269,5272,ἐστὶν ἐπ’ εὐθείας ,ἀπὸ, Πίσης πόλεως ἡμέρας
skylax_syntaxtrees_ud.conllu,5383,5386,ὁ ποταμὸς καὶ ,εἰς, τὸν Πόντον ἐκβάλλει
skylax_syntaxtrees_ud.conllu,5407,5409,τὸν Πόντον ἐκβάλλει ,ἐν, διεσκεδασμένῃ εὐνῇ ὡς
skylax_syntaxtrees_ud.conllu,5441,5444,ὡς ὁ Νεῖλος ,εἰς, Αἴγυπτον. παράπλους δὲ
skylax_syntaxtrees_ud.conllu,5552,5554,Λιβυρνοί εἰσιν ἔθνος. ,ἐν, δὲ τούτῳ τῷ
skylax_syntaxtrees_ud.conllu,5585,5589,ἔθνει πόλεις εἰσὶ ,παρὰ," θάλατταν Ἀρσίας Δασσάτικα,"
skylax_syntaxtrees_ud.conllu,5789,5793,τοῖς πλησιοχώροις ἀνδράσι. ,κατὰ, ταύτην τὴν χώραν
skylax_syntaxtrees_ud.conllu,6128,6132,παροικοῦσιν οἱ Ἰλλυριοὶ ,παρὰ, θάλατταν μέχρι Χαονίας
skylax_syntaxtrees_ud.conllu,6142,6147,Ἰλλυριοὶ παρὰ θάλατταν ,μέχρι, Χαονίας τῆς κατὰ
skylax_syntaxtrees_ud.conllu,6160,6164,μέχρι Χαονίας τῆς ,κατὰ, Κέρκυραν τὴν Ἀλκινόου
skylax_syntaxtrees_ud.conllu,6494,6497,ἐλάσσω τῆς Πελοποννήσου. ,ἀπὸ, δὲ χερρονήσου .
skylax_syntaxtrees_ud.conllu,6529,6533,. νῆσός ἐστι ,παρὰ, στόμιον ὀρθόν· ταύτην
skylax_syntaxtrees_ud.conllu,6663,6666,χώρας ἡμέρας μακρᾶς ,ἐπὶ, Νέστον ποταμόν. Νέστοι.
skylax_syntaxtrees_ud.conllu,6697,6700,ποταμόν. Νέστοι. πλοῦς ,ἀπὸ, δὲ Νέστου ἐστι
skylax_syntaxtrees_ud.conllu,6806,6808,μιᾶς. εἰσὶ δὲ ,ἐν, τούτῳ τῷ κόλπῳ
skylax_syntaxtrees_ud.conllu,6865,6868,Ὀλύντα. αὗται δὲ ,ἀπ’, ἀλλήλων ἀπέχουσι στάδια
skylax_syntaxtrees_ud.conllu,6911,6915,"ἢ ὀλίγῳ πλέον, ",κατὰ, Φάρον καὶ Ἴσσαν.
skylax_syntaxtrees_ud.conllu,7030,7033,Ἑλληνίδες αὗται. πρὶν ,ἐπὶ, τὸν Νάρωνα ποταμὸν
skylax_syntaxtrees_ud.conllu,7091,7094,χώρα ἀνήκει σφόδρα ,εἰς, θάλασσαν. καὶ νῆσος
skylax_syntaxtrees_ud.conllu,7134,7139,τῆς παραλίας χώρας ,ἐγγὺς, ᾗ ὄνομα Μελίτη·
skylax_syntaxtrees_ud.conllu,7172,7177,καὶ ἑτέρα νῆσος ,ἐγγὺς, ταύτης ᾗ ὄνομα
skylax_syntaxtrees_ud.conllu,7313,7316,ἑτέρῳ ἀκρωτηρίῳ καθήκει ,ἐπὶ, τὸν Νάρωνα ποταμόν.
skylax_syntaxtrees_ud.conllu,7337,7340,τὸν Νάρωνα ποταμόν. ,ἀπὸ, δὲ τῆς Μελίτης
skylax_syntaxtrees_ud.conllu,7422,7425,στάδια ηʹ. Μανιοί. ,ἀπὸ, δὲ Νέστων ἐστὶν
skylax_syntaxtrees_ud.conllu,7475,7478,δὲ εἴσπλους ὁ ,εἰς, τὸν Νάρωνά ἐστιν
skylax_syntaxtrees_ud.conllu,7518,7521,στενός· εἰσπλεῖ δὲ ,εἰς, αὐτὸν καὶ τριήρης
skylax_syntaxtrees_ud.conllu,7550,7553,τριήρης καὶ πλοῖα ,εἰς," τὸ ἄνω ἐμπόριον,"
skylax_syntaxtrees_ud.conllu,7578,7581,"ἄνω ἐμπόριον, ἀπέχον ",ἀπὸ, θαλάσσης στάδια πʹ.
skylax_syntaxtrees_ud.conllu,7598,7601,ἀπὸ θαλάσσης στάδια ,πʹ., οὗτοι δέ εἰσιν
skylax_syntaxtrees_ud.conllu,7657,7661,δ’ ἐστὶ τὸ ,εἴσω," τοῦ ἐμπορίου μεγάλη,"
skylax_syntaxtrees_ud.conllu,7702,7705,ἀνήκει ἡ λίμνη ,εἰς," Αὐταριάτας, ἔθνος Ἰλλυρικόν."
skylax_syntaxtrees_ud.conllu,7745,7747,Ἰλλυρικόν. καὶ νῆσος ,ἐν, τῇ λίμνῃ ἔνεστι
skylax_syntaxtrees_ud.conllu,7817,7820,ἐστὶν εὐγέωργος σφόδρα. ,ἀπὸ, δὲ ταύτης τῆς
skylax_syntaxtrees_ud.conllu,7871,7874,ποταμὸς ἀπορρεῖ. καὶ ,ἀπὸ, τοῦ Νάρωνος ἐπὶ
skylax_syntaxtrees_ud.conllu,7887,7890,ἀπὸ τοῦ Νάρωνος ,ἐπὶ, τὸν Ἀρίωνα ποταμὸν
skylax_syntaxtrees_ud.conllu,7929,7932,ἡμέρας ἐστὶ πλοῦς· ,ἀπὸ, δὲ τοῦ Ἀρίωνος
skylax_syntaxtrees_ud.conllu,7948,7951,δὲ τοῦ Ἀρίωνος ,ἐπὶ, τὸν Ῥιζοῦντα ποταμὸν
skylax_syntaxtrees_ud.conllu,8051,8057,"ἐνταῦθα, καὶ ἱερὸν ",ἄπωθεν, τοῦ Ῥιζοῦντος ποταμοῦ.
skylax_syntaxtrees_ud.conllu,8081,8084,τοῦ Ῥιζοῦντος ποταμοῦ. ,ἀπὸ, δὲ τοῦ Ῥιζοῦντος
skylax_syntaxtrees_ud.conllu,8110,8113,τοῦ Ῥιζοῦντος ποταμοῦ ,εἰς, Βουθόην ὁ πλοὺς
skylax_syntaxtrees_ud.conllu,8215,8217,ἐχόμενοι τοῦ Ῥιζοῦντος. ,ἐκ, Βουθόης δὲ εἰς
